,Statement,Verbs/Skills,Grade,Subject
0,"(1) Foundations: inquiry and understanding. The student  develops concepts about self, human relationships, and the environment using elements of drama and conventions of theatre. The student is expected to: (A) develop characterization using sensory and emotional recall; (B) develop body awareness and spatial perceptions using pantomime; (C) respond to sounds, music, images, language, and literature using movement; (D) express emotions and relate ideas using interpretive and planned movement and dialogue; (E) integrate life experiences in dramatic play; (F) portray environment, character, and actions; and (G) demonstrate correct use of basic theatrical  terminology.",develop; use; expect; develop; use; develop; use; use; relate; use; plan; integrate; demonstrate,Grade 5,THEATRE
1,"(2) Creative expression: performance. The student interprets characters using the voice and body expressively and creates dramatizations. The student is expected to: (A) demonstrate safe use of the voice and body; (B) describe characters, their relationships, and their surroundings in detail; (C) create movements and portray a character using dialogue appropriately; (D) dramatize literary selections in unison, pairs, or groups, demonstrating a logical connection of events and describing the characters, their relationships, and their surroundings; and (E) create simple stories collaboratively through  imaginative play, improvisations, and story dramatizations, demonstrating a logical connection of events describing the characters, their relationships, and their surroundings.",interpret; use; create; expect; demonstrate; describe; create; portray; use; dramatize; demonstrate; describe; create; demonstrate; describe,Grade 5,THEATRE
2,"(3) Creative expression: production. The student applies design, directing, and theatre production concepts and skills. The student is expected to: (A) demonstrate character, environment, action, and theme using props, costumes, and visual elements; (B) alter space appropriately to create suitable performance environments for playmaking; (C) plan dramatizations collaboratively; and (D) interact cooperatively with others in dramatizations.",apply; expect; use; alter; create; interact,Grade 5,THEATRE
3,"(4) Historical and cultural relevance. The student relates theatre to history, society, and culture. The student is expected to: (A) explain theatre as a reflection of life in particular times, places, cultures, and oral traditions specific to American history; (B) examine the role of live theatre, film, television, or electronic media throughout American history; and (C) analyze and compare theatre artists and their contributions to theatre and society.",relate; expect; explain; examine; compare,Grade 5,THEATRE
4,"(5) Critical evaluation and response. The student responds to and evaluates theatre and theatrical performances. The student is expected to: (A) analyze and apply appropriate audience behavior at a variety of  performances; (B) compare visual, aural, oral, and kinetic aspects of informal and formal theatre with the elements of art, dance, or music; and (C) identify and discuss how movement, music, or visual elements enhance ideas and emotions depicted in theatre.",respond; evaluate; expect; apply; compare; kinetic; identify; discuss; enhance; depict,Grade 5,THEATRE
